{
  "schemaVersion": 1,
  "id": "r2-7-evidence-derived-operations-contract",
  "suite": "release-system-r2-7",
  "input": {
    "systemVersion": "R2.7"
  },
  "expected": {
    "publisherCount": 1,
    "authorityMutation": "NONE",
    "dispositions": [
      "SAFE_TO_RERUN_FAILED_JOB",
      "FRESH_PERMANENT_DISPATCH_REQUIRED",
      "RECOVERY_REQUEST_REQUIRED",
      "MANUAL_EVIDENCE_REQUIRED",
      "BLOCKED_IDENTITY_MOVED"
    ]
  },
  "meta": {
    "goldenGate": true,
    "coverageExpectation": "EXECUTABLE"
  }
}
