{
  "schemaVersion": 1,
  "id": "stability-seal-v1",
  "suite": "stability-seal",
  "input": {
    "releaseVersion": "0.64.9",
    "releaseId": "simcore-v0.64.9-new-01",
    "workItemIssue": 660,
    "currentLifecycle": "LIVE_PENDING",
    "humanEvidence": "PENDING",
    "observedLabel": "scope:unclassified"
  },
  "expected": {
    "status": "PASS",
    "workItemCloseEligibleAtLivePending": false,
    "labelAuthorityUsed": false,
    "realTerminalProof": "PENDING"
  },
  "meta": {
    "goldenGate": true,
    "coverageExpectation": "EXECUTABLE",
    "source": "docs/SIMCORE_RELEASE_SYSTEM_V2_3_STABILITY_SEAL_DESIGN.md"
  }
}
